{
  "id": 4119,
  "type": "narrator",
  "path": "/people/narrators/4119",
  "titles": {
    "ar": "مُحَمَّدِ بْنِ أَبِي الْعَلَاءِ"
  },
  "versePaths": [
    "/books/al-kafi:1:4:81:9"
  ],
  "verseCount": 1,
  "relations": {},
  "subchains": {
    "3638-4119": {
      "narrator_ids": [
        3638,
        4119
      ],
      "verse_paths": [
        "/books/al-kafi:1:4:81:9"
      ]
    },
    "4-5-90-617-4180-3638-4119": {
      "narrator_ids": [
        4,
        5,
        90,
        617,
        4180,
        3638,
        4119
      ],
      "verse_paths": [
        "/books/al-kafi:1:4:81:9"
      ]
    }
  },
  "source": {
    "provider": "ThaqalaynData",
    "baseUrl": "https://thaqalayndata.netlify.app",
    "localDir": "/home/ali/shia-library-json/tmp/ThaqalaynData",
    "license": "CC0-1.0",
    "dataPath": "/people/narrators/4119",
    "apiUrl": "file:///home/ali/shia-library-json/tmp/ThaqalaynData/people/narrators/4119.json"
  }
}
