{
  "id": 1767,
  "type": "narrator",
  "path": "/people/narrators/1767",
  "titles": {
    "ar": "8ـ الْحُسَيْنُ بْنُ مُحَمَّدٍ"
  },
  "versePaths": [
    "/books/al-kafi:1:4:116:9"
  ],
  "verseCount": 1,
  "relations": {},
  "subchains": {},
  "source": {
    "provider": "ThaqalaynData",
    "baseUrl": "https://thaqalayndata.netlify.app",
    "localDir": "/home/ali/shia-library-json/tmp/ThaqalaynData",
    "license": "CC0-1.0",
    "dataPath": "/people/narrators/1767",
    "apiUrl": "file:///home/ali/shia-library-json/tmp/ThaqalaynData/people/narrators/1767.json"
  }
}
