{
  "id": 3317,
  "type": "narrator",
  "path": "/people/narrators/3317",
  "titles": {
    "ar": "سَعْدِ بْنِ طَرِيفٍ الْإِسْكَافِ"
  },
  "versePaths": [
    "/books/al-kafi:7:4:42:7"
  ],
  "verseCount": 1,
  "relations": {},
  "subchains": {
    "11-185-446-60-3317-9": {
      "narrator_ids": [
        11,
        185,
        446,
        60,
        3317,
        9
      ],
      "verse_paths": [
        "/books/al-kafi:7:4:42:7"
      ]
    },
    "3317-9": {
      "narrator_ids": [
        3317,
        9
      ],
      "verse_paths": [
        "/books/al-kafi:7:4:42:7"
      ]
    },
    "60-3317": {
      "narrator_ids": [
        60,
        3317
      ],
      "verse_paths": [
        "/books/al-kafi:7:4:42:7"
      ]
    }
  },
  "source": {
    "provider": "ThaqalaynData",
    "baseUrl": "https://thaqalayndata.netlify.app",
    "localDir": "/home/ali/shia-library-json/tmp/ThaqalaynData",
    "license": "CC0-1.0",
    "dataPath": "/people/narrators/3317",
    "apiUrl": "file:///home/ali/shia-library-json/tmp/ThaqalaynData/people/narrators/3317.json"
  }
}
