{
  "id": 2726,
  "type": "narrator",
  "path": "/people/narrators/2726",
  "titles": {
    "ar": "الْعَبَّاسِ بْنِ هِلَالٍ"
  },
  "versePaths": [
    "/books/al-kafi:1:3:16:4",
    "/books/man-la-yahduruhu-al-faqih:1:64:10",
    "/books/mujam-al-ahadith-al-mutabara:3:103:1",
    "/books/tahdhib-al-ahkam:2:8:201",
    "/books/tahdhib-al-ahkam:6:90:211",
    "/books/tahdhib-al-ahkam:9:34:17"
  ],
  "verseCount": 6,
  "relations": {},
  "subchains": {
    "101-2726": {
      "narrator_ids": [
        101,
        2726
      ],
      "verse_paths": [
        "/books/al-kafi:1:3:16:4"
      ]
    },
    "11-247-2726-98": {
      "narrator_ids": [
        11,
        247,
        2726,
        98
      ],
      "verse_paths": [
        "/books/tahdhib-al-ahkam:9:34:17"
      ]
    },
    "2-1538-247-2726": {
      "narrator_ids": [
        2,
        1538,
        247,
        2726
      ],
      "verse_paths": [
        "/books/tahdhib-al-ahkam:6:90:211"
      ]
    },
    "237-2726": {
      "narrator_ids": [
        237,
        2726
      ],
      "verse_paths": [
        "/books/mujam-al-ahadith-al-mutabara:3:103:1"
      ]
    },
    "237-2726-64": {
      "narrator_ids": [
        237,
        2726,
        64
      ],
      "verse_paths": [
        "/books/mujam-al-ahadith-al-mutabara:3:103:1"
      ]
    },
    "247-2726": {
      "narrator_ids": [
        247,
        2726
      ],
      "verse_paths": [
        "/books/tahdhib-al-ahkam:6:90:211",
        "/books/tahdhib-al-ahkam:9:34:17"
      ]
    },
    "2726-64": {
      "narrator_ids": [
        2726,
        64
      ],
      "verse_paths": [
        "/books/mujam-al-ahadith-al-mutabara:3:103:1"
      ]
    },
    "2726-98": {
      "narrator_ids": [
        2726,
        98
      ],
      "verse_paths": [
        "/books/man-la-yahduruhu-al-faqih:1:64:10",
        "/books/tahdhib-al-ahkam:2:8:201",
        "/books/tahdhib-al-ahkam:9:34:17"
      ]
    },
    "2726-98-2": {
      "narrator_ids": [
        2726,
        98,
        2
      ],
      "verse_paths": [
        "/books/man-la-yahduruhu-al-faqih:1:64:10",
        "/books/tahdhib-al-ahkam:2:8:201"
      ]
    },
    "35-8-101-2726": {
      "narrator_ids": [
        35,
        8,
        101,
        2726
      ],
      "verse_paths": [
        "/books/al-kafi:1:3:16:4"
      ]
    }
  },
  "source": {
    "provider": "ThaqalaynData",
    "baseUrl": "https://thaqalayndata.netlify.app",
    "localDir": "/home/ali/shia-library-json/tmp/ThaqalaynData",
    "license": "CC0-1.0",
    "dataPath": "/people/narrators/2726",
    "apiUrl": "file:///home/ali/shia-library-json/tmp/ThaqalaynData/people/narrators/2726.json"
  }
}
