{
  "id": 554,
  "type": "narrator",
  "path": "/people/narrators/554",
  "titles": {
    "ar": "مَالِكٍ الْجُهَنِيِّ"
  },
  "versePaths": [
    "/books/al-kafi:1:3:24:12",
    "/books/al-kafi:1:3:24:5",
    "/books/al-kafi:1:4:108:21",
    "/books/al-kafi:1:4:108:61",
    "/books/al-kafi:2:1:78:6",
    "/books/al-kafi:3:1:37:7",
    "/books/al-kafi:4:2:75:18",
    "/books/al-kafi:8:1:33:15",
    "/books/fadail-al-shia:35:1",
    "/books/kamil-al-ziyarat:2:27:15",
    "/books/kitab-al-ghayba-numani:2:22:3",
    "/books/kitab-al-ghayba-tusi:27:15",
    "/books/kitab-al-ghayba-tusi:39:3",
    "/books/tahdhib-al-ahkam:1:38:1",
    "/books/tahdhib-al-ahkam:2:13:33",
    "/books/tahdhib-al-ahkam:4:27:3"
  ],
  "verseCount": 16,
  "relations": {},
  "subchains": {
    "11-158-51-554": {
      "narrator_ids": [
        11,
        158,
        51,
        554
      ],
      "verse_paths": [
        "/books/tahdhib-al-ahkam:2:13:33"
      ]
    },
    "11-51-554": {
      "narrator_ids": [
        11,
        51,
        554
      ],
      "verse_paths": [
        "/books/al-kafi:8:1:33:15"
      ]
    },
    "128-554": {
      "narrator_ids": [
        128,
        554
      ],
      "verse_paths": [
        "/books/kitab-al-ghayba-numani:2:22:3"
      ]
    },
    "141-554": {
      "narrator_ids": [
        141,
        554
      ],
      "verse_paths": [
        "/books/al-kafi:1:4:108:21",
        "/books/al-kafi:1:4:108:61"
      ]
    },
    "161-554": {
      "narrator_ids": [
        161,
        554
      ],
      "verse_paths": [
        "/books/kitab-al-ghayba-tusi:27:15",
        "/books/kitab-al-ghayba-tusi:39:3"
      ]
    },
    "174-554": {
      "narrator_ids": [
        174,
        554
      ],
      "verse_paths": [
        "/books/kamil-al-ziyarat:2:27:15"
      ]
    },
    "181-554": {
      "narrator_ids": [
        181,
        554
      ],
      "verse_paths": [
        "/books/al-kafi:2:1:78:6"
      ]
    },
    "20-25-61-215-141-554": {
      "narrator_ids": [
        20,
        25,
        61,
        215,
        141,
        554
      ],
      "verse_paths": [
        "/books/al-kafi:1:4:108:21"
      ]
    },
    "219-409-68-223-51-554": {
      "narrator_ids": [
        219,
        409,
        68,
        223,
        51,
        554
      ],
      "verse_paths": [
        "/books/al-kafi:1:3:24:5"
      ]
    },
    "26-554": {
      "narrator_ids": [
        26,
        554
      ],
      "verse_paths": [
        "/books/al-kafi:1:3:24:12"
      ]
    },
    "3-27-26-181-554": {
      "narrator_ids": [
        3,
        27,
        26,
        181,
        554
      ],
      "verse_paths": [
        "/books/al-kafi:2:1:78:6"
      ]
    },
    "4-5-42-51-554": {
      "narrator_ids": [
        4,
        5,
        42,
        51,
        554
      ],
      "verse_paths": [
        "/books/al-kafi:3:1:37:7"
      ]
    },
    "4169-244-161-554-322": {
      "narrator_ids": [
        4169,
        244,
        161,
        554,
        322
      ],
      "verse_paths": [
        "/books/kitab-al-ghayba-tusi:39:3"
      ]
    },
    "4415-161-554-300-4169-244-161-554-322": {
      "narrator_ids": [
        4415,
        161,
        554,
        300,
        4169,
        244,
        161,
        554,
        322
      ],
      "verse_paths": [
        "/books/kitab-al-ghayba-tusi:27:15"
      ]
    },
    "4521-104-128-554": {
      "narrator_ids": [
        4521,
        104,
        128,
        554
      ],
      "verse_paths": [
        "/books/kitab-al-ghayba-numani:2:22:3"
      ]
    },
    "5-21-69-579-554": {
      "narrator_ids": [
        5,
        21,
        69,
        579,
        554
      ],
      "verse_paths": [
        "/books/al-kafi:4:2:75:18"
      ]
    },
    "5-42-51-554": {
      "narrator_ids": [
        5,
        42,
        51,
        554
      ],
      "verse_paths": [
        "/books/tahdhib-al-ahkam:1:38:1"
      ]
    },
    "50-127-26-554": {
      "narrator_ids": [
        50,
        127,
        26,
        554
      ],
      "verse_paths": [
        "/books/al-kafi:1:3:24:12"
      ]
    },
    "51-554": {
      "narrator_ids": [
        51,
        554
      ],
      "verse_paths": [
        "/books/al-kafi:1:3:24:5",
        "/books/al-kafi:3:1:37:7",
        "/books/al-kafi:8:1:33:15",
        "/books/tahdhib-al-ahkam:1:38:1",
        "/books/tahdhib-al-ahkam:2:13:33"
      ]
    },
    "554-300": {
      "narrator_ids": [
        554,
        300
      ],
      "verse_paths": [
        "/books/kitab-al-ghayba-tusi:27:15"
      ]
    },
    "554-322": {
      "narrator_ids": [
        554,
        322
      ],
      "verse_paths": [
        "/books/kitab-al-ghayba-tusi:27:15",
        "/books/kitab-al-ghayba-tusi:39:3"
      ]
    },
    "554-669": {
      "narrator_ids": [
        554,
        669
      ],
      "verse_paths": [
        "/books/fadail-al-shia:35:1",
        "/books/kamil-al-ziyarat:2:27:15"
      ]
    },
    "579-554": {
      "narrator_ids": [
        579,
        554
      ],
      "verse_paths": [
        "/books/al-kafi:4:2:75:18",
        "/books/tahdhib-al-ahkam:4:27:3"
      ]
    },
    "600-4169-30-174-554-669": {
      "narrator_ids": [
        600,
        4169,
        30,
        174,
        554,
        669
      ],
      "verse_paths": [
        "/books/kamil-al-ziyarat:2:27:15"
      ]
    },
    "92-786-141-554": {
      "narrator_ids": [
        92,
        786,
        141,
        554
      ],
      "verse_paths": [
        "/books/al-kafi:1:4:108:61"
      ]
    },
    "952-6-5-21-69-579-554": {
      "narrator_ids": [
        952,
        6,
        5,
        21,
        69,
        579,
        554
      ],
      "verse_paths": [
        "/books/tahdhib-al-ahkam:4:27:3"
      ]
    }
  },
  "source": {
    "provider": "ThaqalaynData",
    "baseUrl": "https://thaqalayndata.netlify.app",
    "localDir": "/home/ali/shia-library-json/tmp/ThaqalaynData",
    "license": "CC0-1.0",
    "dataPath": "/people/narrators/554",
    "apiUrl": "file:///home/ali/shia-library-json/tmp/ThaqalaynData/people/narrators/554.json"
  }
}
