{
  "id": 1161,
  "type": "narrator",
  "path": "/people/narrators/1161",
  "titles": {
    "ar": "عَلِيِّ بْنِ سَيْفِ بْنِ عَمِيرَةَ",
    "en": "Ali ibn Sayf ibn Amira"
  },
  "versePaths": [
    "/books/al-kafi:1:3:22:5",
    "/books/al-kafi:3:4:4:6",
    "/books/al-kafi:3:4:5:2",
    "/books/tahdhib-al-ahkam:10:9:151",
    "/books/tahdhib-al-ahkam:2:4:7",
    "/books/tahdhib-al-ahkam:2:4:72",
    "/books/tahdhib-al-ahkam:6:2:2"
  ],
  "verseCount": 7,
  "relations": {},
  "subchains": {
    "11-4-167-1161-2-389-669": {
      "narrator_ids": [
        11,
        4,
        167,
        1161,
        2,
        389,
        669
      ],
      "verse_paths": [
        "/books/tahdhib-al-ahkam:2:4:7"
      ]
    },
    "1161-117": {
      "narrator_ids": [
        1161,
        117
      ],
      "verse_paths": [
        "/books/tahdhib-al-ahkam:10:9:151"
      ]
    },
    "1161-1222": {
      "narrator_ids": [
        1161,
        1222
      ],
      "verse_paths": [
        "/books/tahdhib-al-ahkam:6:2:2"
      ]
    },
    "1161-2": {
      "narrator_ids": [
        1161,
        2
      ],
      "verse_paths": [
        "/books/al-kafi:3:4:4:6",
        "/books/al-kafi:3:4:5:2",
        "/books/tahdhib-al-ahkam:2:4:7",
        "/books/tahdhib-al-ahkam:2:4:72"
      ]
    },
    "167-1161": {
      "narrator_ids": [
        167,
        1161
      ],
      "verse_paths": [
        "/books/al-kafi:3:4:4:6",
        "/books/al-kafi:3:4:5:2",
        "/books/tahdhib-al-ahkam:10:9:151",
        "/books/tahdhib-al-ahkam:2:4:7",
        "/books/tahdhib-al-ahkam:2:4:72"
      ]
    },
    "2465-1161": {
      "narrator_ids": [
        2465,
        1161
      ],
      "verse_paths": [
        "/books/al-kafi:1:3:22:5"
      ]
    },
    "35-8-3398-2465-1161": {
      "narrator_ids": [
        35,
        8,
        3398,
        2465,
        1161
      ],
      "verse_paths": [
        "/books/al-kafi:1:3:22:5"
      ]
    },
    "4-167-1161-2-389-669": {
      "narrator_ids": [
        4,
        167,
        1161,
        2,
        389,
        669
      ],
      "verse_paths": [
        "/books/al-kafi:3:4:5:2"
      ]
    },
    "4-167-1161-2-451-669": {
      "narrator_ids": [
        4,
        167,
        1161,
        2,
        451,
        669
      ],
      "verse_paths": [
        "/books/al-kafi:3:4:4:6"
      ]
    },
    "4286-167-1161-117-72-9": {
      "narrator_ids": [
        4286,
        167,
        1161,
        117,
        72,
        9
      ],
      "verse_paths": [
        "/books/tahdhib-al-ahkam:10:9:151"
      ]
    },
    "781-1161": {
      "narrator_ids": [
        781,
        1161
      ],
      "verse_paths": [
        "/books/tahdhib-al-ahkam:6:2:2"
      ]
    },
    "952-4-167-1161-2-451-669": {
      "narrator_ids": [
        952,
        4,
        167,
        1161,
        2,
        451,
        669
      ],
      "verse_paths": [
        "/books/tahdhib-al-ahkam:2:4:72"
      ]
    },
    "952-4-781-1161-1222-2": {
      "narrator_ids": [
        952,
        4,
        781,
        1161,
        1222,
        2
      ],
      "verse_paths": [
        "/books/tahdhib-al-ahkam:6:2:2"
      ]
    }
  },
  "source": {
    "provider": "ThaqalaynData",
    "baseUrl": "https://thaqalayndata.netlify.app",
    "localDir": "/home/ali/shia-library-json/tmp/ThaqalaynData",
    "license": "CC0-1.0",
    "dataPath": "/people/narrators/1161",
    "apiUrl": "file:///home/ali/shia-library-json/tmp/ThaqalaynData/people/narrators/1161.json"
  }
}
