{
  "id": 586,
  "type": "narrator",
  "path": "/people/narrators/586",
  "titles": {
    "ar": "سَعْدِ بْنِ سَعْدٍ الْأَشْعَرِيِّ"
  },
  "versePaths": [
    "/books/al-istibsar:1:255:2",
    "/books/al-istibsar:2:22:3",
    "/books/al-istibsar:2:4:1",
    "/books/al-kafi:3:5:12:4",
    "/books/al-kafi:3:5:7:5",
    "/books/al-kafi:4:2:30:2",
    "/books/al-kafi:4:2:51:3",
    "/books/al-kafi:4:2:75:5",
    "/books/al-kafi:6:1:28:8",
    "/books/al-kafi:6:1:36:1",
    "/books/al-kafi:6:6:6:8",
    "/books/man-la-yahduruhu-al-faqih:2:2:37:2",
    "/books/man-la-yahduruhu-al-faqih:2:3:149:8",
    "/books/tahdhib-al-ahkam:2:10:67",
    "/books/tahdhib-al-ahkam:2:11:27",
    "/books/tahdhib-al-ahkam:2:8:100",
    "/books/tahdhib-al-ahkam:2:8:175",
    "/books/tahdhib-al-ahkam:2:8:250",
    "/books/tahdhib-al-ahkam:3:25:45",
    "/books/tahdhib-al-ahkam:3:27:23",
    "/books/tahdhib-al-ahkam:4:25:1",
    "/books/tahdhib-al-ahkam:5:24:56",
    "/books/tahdhib-al-ahkam:6:53:10",
    "/books/tahdhib-al-ahkam:8:5:12",
    "/books/tahdhib-al-ahkam:8:5:41",
    "/books/tahdhib-al-ahkam:8:7:17",
    "/books/tahdhib-al-ahkam:9:1:184"
  ],
  "verseCount": 27,
  "relations": {},
  "subchains": {
    "11-259-586-98": {
      "narrator_ids": [
        11,
        259,
        586,
        98
      ],
      "verse_paths": [
        "/books/tahdhib-al-ahkam:2:8:100",
        "/books/tahdhib-al-ahkam:3:25:45"
      ]
    },
    "11-4-12-586": {
      "narrator_ids": [
        11,
        4,
        12,
        586
      ],
      "verse_paths": [
        "/books/tahdhib-al-ahkam:8:5:41"
      ]
    },
    "11-4-5-99-586-98": {
      "narrator_ids": [
        11,
        4,
        5,
        99,
        586,
        98
      ],
      "verse_paths": [
        "/books/tahdhib-al-ahkam:8:5:12"
      ]
    },
    "11-586": {
      "narrator_ids": [
        11,
        586
      ],
      "verse_paths": [
        "/books/tahdhib-al-ahkam:3:27:23"
      ]
    },
    "11-586-98": {
      "narrator_ids": [
        11,
        586,
        98
      ],
      "verse_paths": [
        "/books/tahdhib-al-ahkam:3:27:23"
      ]
    },
    "12-586": {
      "narrator_ids": [
        12,
        586
      ],
      "verse_paths": [
        "/books/al-kafi:6:1:36:1",
        "/books/tahdhib-al-ahkam:8:5:41"
      ]
    },
    "13-259-586": {
      "narrator_ids": [
        13,
        259,
        586
      ],
      "verse_paths": [
        "/books/tahdhib-al-ahkam:2:10:67"
      ]
    },
    "13-259-586-98": {
      "narrator_ids": [
        13,
        259,
        586,
        98
      ],
      "verse_paths": [
        "/books/tahdhib-al-ahkam:2:8:175",
        "/books/tahdhib-al-ahkam:2:8:250",
        "/books/tahdhib-al-ahkam:5:24:56",
        "/books/tahdhib-al-ahkam:8:7:17"
      ]
    },
    "1507-586": {
      "narrator_ids": [
        1507,
        586
      ],
      "verse_paths": [
        "/books/al-istibsar:2:22:3"
      ]
    },
    "259-586": {
      "narrator_ids": [
        259,
        586
      ],
      "verse_paths": [
        "/books/al-kafi:3:5:7:5",
        "/books/al-kafi:6:6:6:8",
        "/books/tahdhib-al-ahkam:2:10:67",
        "/books/tahdhib-al-ahkam:2:11:27",
        "/books/tahdhib-al-ahkam:2:8:100",
        "/books/tahdhib-al-ahkam:2:8:175",
        "/books/tahdhib-al-ahkam:2:8:250",
        "/books/tahdhib-al-ahkam:3:25:45",
        "/books/tahdhib-al-ahkam:5:24:56",
        "/books/tahdhib-al-ahkam:6:53:10",
        "/books/tahdhib-al-ahkam:8:7:17",
        "/books/tahdhib-al-ahkam:9:1:184"
      ]
    },
    "259-586-98": {
      "narrator_ids": [
        259,
        586,
        98
      ],
      "verse_paths": [
        "/books/tahdhib-al-ahkam:6:53:10"
      ]
    },
    "4-12-586": {
      "narrator_ids": [
        4,
        12,
        586
      ],
      "verse_paths": [
        "/books/al-kafi:6:1:36:1"
      ]
    },
    "4-5-259-586-98": {
      "narrator_ids": [
        4,
        5,
        259,
        586,
        98
      ],
      "verse_paths": [
        "/books/al-kafi:6:6:6:8",
        "/books/tahdhib-al-ahkam:9:1:184"
      ]
    },
    "4-5-99-586-98": {
      "narrator_ids": [
        4,
        5,
        99,
        586,
        98
      ],
      "verse_paths": [
        "/books/al-kafi:4:2:30:2",
        "/books/al-kafi:4:2:75:5",
        "/books/al-kafi:6:1:28:8"
      ]
    },
    "5-259-586-184": {
      "narrator_ids": [
        5,
        259,
        586,
        184
      ],
      "verse_paths": [
        "/books/tahdhib-al-ahkam:2:11:27"
      ]
    },
    "5-586": {
      "narrator_ids": [
        5,
        586
      ],
      "verse_paths": [
        "/books/al-istibsar:1:255:2"
      ]
    },
    "5-586-98": {
      "narrator_ids": [
        5,
        586,
        98
      ],
      "verse_paths": [
        "/books/al-istibsar:1:255:2"
      ]
    },
    "555-586": {
      "narrator_ids": [
        555,
        586
      ],
      "verse_paths": [
        "/books/al-kafi:3:5:12:4"
      ]
    },
    "586-184": {
      "narrator_ids": [
        586,
        184
      ],
      "verse_paths": [
        "/books/man-la-yahduruhu-al-faqih:2:3:149:8",
        "/books/tahdhib-al-ahkam:2:11:27"
      ]
    },
    "586-98": {
      "narrator_ids": [
        586,
        98
      ],
      "verse_paths": [
        "/books/al-istibsar:1:255:2",
        "/books/al-istibsar:2:4:1",
        "/books/al-kafi:3:5:12:4",
        "/books/al-kafi:4:2:30:2",
        "/books/al-kafi:4:2:51:3",
        "/books/al-kafi:4:2:75:5",
        "/books/al-kafi:6:1:28:8",
        "/books/al-kafi:6:6:6:8",
        "/books/man-la-yahduruhu-al-faqih:2:2:37:2",
        "/books/tahdhib-al-ahkam:2:8:100",
        "/books/tahdhib-al-ahkam:2:8:175",
        "/books/tahdhib-al-ahkam:2:8:250",
        "/books/tahdhib-al-ahkam:3:25:45",
        "/books/tahdhib-al-ahkam:3:27:23",
        "/books/tahdhib-al-ahkam:4:25:1",
        "/books/tahdhib-al-ahkam:5:24:56",
        "/books/tahdhib-al-ahkam:6:53:10",
        "/books/tahdhib-al-ahkam:8:5:12",
        "/books/tahdhib-al-ahkam:8:7:17",
        "/books/tahdhib-al-ahkam:9:1:184"
      ]
    },
    "6-5-259-586": {
      "narrator_ids": [
        6,
        5,
        259,
        586
      ],
      "verse_paths": [
        "/books/al-kafi:3:5:7:5"
      ]
    },
    "6-5-555-586-98": {
      "narrator_ids": [
        6,
        5,
        555,
        586,
        98
      ],
      "verse_paths": [
        "/books/al-kafi:3:5:12:4"
      ]
    },
    "6-5-99-586-98": {
      "narrator_ids": [
        6,
        5,
        99,
        586,
        98
      ],
      "verse_paths": [
        "/books/al-kafi:4:2:51:3"
      ]
    },
    "695-9-1507-586": {
      "narrator_ids": [
        695,
        9,
        1507,
        586
      ],
      "verse_paths": [
        "/books/al-istibsar:2:22:3"
      ]
    },
    "952-4-5-99-586-98": {
      "narrator_ids": [
        952,
        4,
        5,
        99,
        586,
        98
      ],
      "verse_paths": [
        "/books/al-istibsar:2:4:1",
        "/books/tahdhib-al-ahkam:4:25:1"
      ]
    },
    "99-586": {
      "narrator_ids": [
        99,
        586
      ],
      "verse_paths": [
        "/books/al-istibsar:2:4:1",
        "/books/al-kafi:4:2:30:2",
        "/books/al-kafi:4:2:51:3",
        "/books/al-kafi:4:2:75:5",
        "/books/al-kafi:6:1:28:8",
        "/books/man-la-yahduruhu-al-faqih:2:2:37:2",
        "/books/tahdhib-al-ahkam:4:25:1",
        "/books/tahdhib-al-ahkam:8:5:12"
      ]
    },
    "99-586-98": {
      "narrator_ids": [
        99,
        586,
        98
      ],
      "verse_paths": [
        "/books/man-la-yahduruhu-al-faqih:2:2:37:2"
      ]
    }
  },
  "source": {
    "provider": "ThaqalaynData",
    "baseUrl": "https://thaqalayndata.netlify.app",
    "localDir": "/home/ali/shia-library-json/tmp/ThaqalaynData",
    "license": "CC0-1.0",
    "dataPath": "/people/narrators/586",
    "apiUrl": "file:///home/ali/shia-library-json/tmp/ThaqalaynData/people/narrators/586.json"
  }
}
