{
  "id": 4538,
  "type": "narrator",
  "path": "/people/narrators/4538",
  "titles": {
    "ar": "يَحْيَى الطَّوِيلِ"
  },
  "versePaths": [
    "/books/al-kafi:5:1:27:1",
    "/books/tahdhib-al-ahkam:6:78:3"
  ],
  "verseCount": 2,
  "relations": {},
  "subchains": {
    "3-2-7-4538-669": {
      "narrator_ids": [
        3,
        2,
        7,
        4538,
        669
      ],
      "verse_paths": [
        "/books/al-kafi:5:1:27:1",
        "/books/tahdhib-al-ahkam:6:78:3"
      ]
    },
    "4538-669": {
      "narrator_ids": [
        4538,
        669
      ],
      "verse_paths": [
        "/books/al-kafi:5:1:27:1",
        "/books/tahdhib-al-ahkam:6:78:3"
      ]
    },
    "7-4538": {
      "narrator_ids": [
        7,
        4538
      ],
      "verse_paths": [
        "/books/al-kafi:5:1:27:1",
        "/books/tahdhib-al-ahkam:6:78:3"
      ]
    }
  },
  "source": {
    "provider": "ThaqalaynData",
    "baseUrl": "https://thaqalayndata.netlify.app",
    "localDir": "/home/ali/shia-library-json/tmp/ThaqalaynData",
    "license": "CC0-1.0",
    "dataPath": "/people/narrators/4538",
    "apiUrl": "file:///home/ali/shia-library-json/tmp/ThaqalaynData/people/narrators/4538.json"
  }
}
