{
  "id": 1631,
  "type": "narrator",
  "path": "/people/narrators/1631",
  "titles": {
    "ar": "مُثَنَّى بْنِ الْوَلِيدِ"
  },
  "versePaths": [
    "/books/al-kafi:3:3:56:1",
    "/books/al-kafi:7:1:37:19",
    "/books/tahdhib-al-ahkam:9:19:17",
    "/books/tahdhib-al-ahkam:9:24:9"
  ],
  "verseCount": 4,
  "relations": {},
  "subchains": {
    "11-763-1631-393-669": {
      "narrator_ids": [
        11,
        763,
        1631,
        393,
        669
      ],
      "verse_paths": [
        "/books/tahdhib-al-ahkam:9:24:9"
      ]
    },
    "1631-16": {
      "narrator_ids": [
        1631,
        16
      ],
      "verse_paths": [
        "/books/al-kafi:7:1:37:19",
        "/books/tahdhib-al-ahkam:9:19:17"
      ]
    },
    "1631-18": {
      "narrator_ids": [
        1631,
        18
      ],
      "verse_paths": [
        "/books/al-kafi:3:3:56:1"
      ]
    },
    "1631-393": {
      "narrator_ids": [
        1631,
        393
      ],
      "verse_paths": [
        "/books/tahdhib-al-ahkam:9:24:9"
      ]
    },
    "39-1631": {
      "narrator_ids": [
        39,
        1631
      ],
      "verse_paths": [
        "/books/al-kafi:3:3:56:1"
      ]
    },
    "5-237-763-1631-16-3198": {
      "narrator_ids": [
        5,
        237,
        763,
        1631,
        16,
        3198
      ],
      "verse_paths": [
        "/books/al-kafi:7:1:37:19",
        "/books/tahdhib-al-ahkam:9:19:17"
      ]
    },
    "6-8-39-1631-18-9": {
      "narrator_ids": [
        6,
        8,
        39,
        1631,
        18,
        9
      ],
      "verse_paths": [
        "/books/al-kafi:3:3:56:1"
      ]
    },
    "763-1631": {
      "narrator_ids": [
        763,
        1631
      ],
      "verse_paths": [
        "/books/al-kafi:7:1:37:19",
        "/books/tahdhib-al-ahkam:9:19:17",
        "/books/tahdhib-al-ahkam:9:24:9"
      ]
    }
  },
  "source": {
    "provider": "ThaqalaynData",
    "baseUrl": "https://thaqalayndata.netlify.app",
    "localDir": "/home/ali/shia-library-json/tmp/ThaqalaynData",
    "license": "CC0-1.0",
    "dataPath": "/people/narrators/1631",
    "apiUrl": "file:///home/ali/shia-library-json/tmp/ThaqalaynData/people/narrators/1631.json"
  }
}
