{
  "id": 1086,
  "type": "narrator",
  "path": "/people/narrators/1086",
  "titles": {
    "ar": "حَمَّادِ بْنِ أَبِي طَلْحَةَ"
  },
  "versePaths": [
    "/books/al-istibsar:1:125:46",
    "/books/al-kafi:1:4:129:3",
    "/books/al-kafi:2:1:91:1",
    "/books/al-kafi:8:1:43:6",
    "/books/mujam-al-ahadith-al-mutabara:3:9:3",
    "/books/tahdhib-al-ahkam:2:13:61"
  ],
  "verseCount": 6,
  "relations": {},
  "subchains": {
    "1086-126": {
      "narrator_ids": [
        1086,
        126
      ],
      "verse_paths": [
        "/books/mujam-al-ahadith-al-mutabara:3:9:3"
      ]
    },
    "1086-3034": {
      "narrator_ids": [
        1086,
        3034
      ],
      "verse_paths": [
        "/books/al-kafi:2:1:91:1"
      ]
    },
    "1086-4379": {
      "narrator_ids": [
        1086,
        4379
      ],
      "verse_paths": [
        "/books/al-kafi:1:4:129:3"
      ]
    },
    "1086-602": {
      "narrator_ids": [
        1086,
        602
      ],
      "verse_paths": [
        "/books/al-kafi:8:1:43:6"
      ]
    },
    "11-1086": {
      "narrator_ids": [
        11,
        1086
      ],
      "verse_paths": [
        "/books/tahdhib-al-ahkam:2:13:61"
      ]
    },
    "11-2264-1086": {
      "narrator_ids": [
        11,
        2264,
        1086
      ],
      "verse_paths": [
        "/books/al-istibsar:1:125:46"
      ]
    },
    "2264-1086": {
      "narrator_ids": [
        2264,
        1086
      ],
      "verse_paths": [
        "/books/al-istibsar:1:125:46"
      ]
    },
    "292-1086": {
      "narrator_ids": [
        292,
        1086
      ],
      "verse_paths": [
        "/books/mujam-al-ahadith-al-mutabara:3:9:3"
      ]
    },
    "4-5-42-1086-3034": {
      "narrator_ids": [
        4,
        5,
        42,
        1086,
        3034
      ],
      "verse_paths": [
        "/books/al-kafi:2:1:91:1"
      ]
    },
    "42-1086": {
      "narrator_ids": [
        42,
        1086
      ],
      "verse_paths": [
        "/books/al-kafi:1:4:129:3",
        "/books/al-kafi:2:1:91:1",
        "/books/al-kafi:8:1:43:6"
      ]
    },
    "4317-695-26-189-623-292-1086-126": {
      "narrator_ids": [
        4317,
        695,
        26,
        189,
        623,
        292,
        1086,
        126
      ],
      "verse_paths": [
        "/books/mujam-al-ahadith-al-mutabara:3:9:3"
      ]
    },
    "77-5-42-1086-4379": {
      "narrator_ids": [
        77,
        5,
        42,
        1086,
        4379
      ],
      "verse_paths": [
        "/books/al-kafi:1:4:129:3"
      ]
    },
    "8-42-1086-602": {
      "narrator_ids": [
        8,
        42,
        1086,
        602
      ],
      "verse_paths": [
        "/books/al-kafi:8:1:43:6"
      ]
    }
  },
  "source": {
    "provider": "ThaqalaynData",
    "baseUrl": "https://thaqalayndata.netlify.app",
    "localDir": "/home/ali/shia-library-json/tmp/ThaqalaynData",
    "license": "CC0-1.0",
    "dataPath": "/people/narrators/1086",
    "apiUrl": "file:///home/ali/shia-library-json/tmp/ThaqalaynData/people/narrators/1086.json"
  }
}
