{
  "id": 2601,
  "type": "narrator",
  "path": "/people/narrators/2601",
  "titles": {
    "ar": "الْحُسَيْنِ بْنِ أَبِي سَعِيدٍ الْمُكَارِي"
  },
  "versePaths": [
    "/books/al-kafi:4:1:34:5"
  ],
  "verseCount": 1,
  "relations": {},
  "subchains": {
    "15-2601": {
      "narrator_ids": [
        15,
        2601
      ],
      "verse_paths": [
        "/books/al-kafi:4:1:34:5"
      ]
    },
    "2601-60": {
      "narrator_ids": [
        2601,
        60
      ],
      "verse_paths": [
        "/books/al-kafi:4:1:34:5"
      ]
    },
    "4-5-15-2601-60-669": {
      "narrator_ids": [
        4,
        5,
        15,
        2601,
        60,
        669
      ],
      "verse_paths": [
        "/books/al-kafi:4:1:34:5"
      ]
    }
  },
  "source": {
    "provider": "ThaqalaynData",
    "baseUrl": "https://thaqalayndata.netlify.app",
    "localDir": "/home/ali/shia-library-json/tmp/ThaqalaynData",
    "license": "CC0-1.0",
    "dataPath": "/people/narrators/2601",
    "apiUrl": "file:///home/ali/shia-library-json/tmp/ThaqalaynData/people/narrators/2601.json"
  }
}
