{
  "id": 2710,
  "type": "narrator",
  "path": "/people/narrators/2710",
  "titles": {
    "ar": "الصَّادِقِ أَبِي الْحَسَنِ الثَّالِثِ ( عليه السلام )"
  },
  "versePaths": [
    "/books/al-kafi:4:3:227:1"
  ],
  "verseCount": 1,
  "relations": {},
  "subchains": {
    "6-8-2710": {
      "narrator_ids": [
        6,
        8,
        2710
      ],
      "verse_paths": [
        "/books/al-kafi:4:3:227:1"
      ]
    },
    "8-2710": {
      "narrator_ids": [
        8,
        2710
      ],
      "verse_paths": [
        "/books/al-kafi:4:3:227:1"
      ]
    }
  },
  "source": {
    "provider": "ThaqalaynData",
    "baseUrl": "https://thaqalayndata.netlify.app",
    "localDir": "/home/ali/shia-library-json/tmp/ThaqalaynData",
    "license": "CC0-1.0",
    "dataPath": "/people/narrators/2710",
    "apiUrl": "file:///home/ali/shia-library-json/tmp/ThaqalaynData/people/narrators/2710.json"
  }
}
