{
  "id": 3732,
  "type": "narrator",
  "path": "/people/narrators/3732",
  "titles": {
    "ar": "عَلِيِّ بْنِ إِسْحَاقَ بْنِ سَعْدٍ"
  },
  "versePaths": [
    "/books/al-istibsar:1:113:3",
    "/books/al-kafi:6:8:35:3"
  ],
  "verseCount": 2,
  "relations": {},
  "subchains": {
    "11-3732": {
      "narrator_ids": [
        11,
        3732
      ],
      "verse_paths": [
        "/books/al-istibsar:1:113:3"
      ]
    },
    "12-3732": {
      "narrator_ids": [
        12,
        3732
      ],
      "verse_paths": [
        "/books/al-kafi:6:8:35:3"
      ]
    },
    "3732-26": {
      "narrator_ids": [
        3732,
        26
      ],
      "verse_paths": [
        "/books/al-kafi:6:8:35:3"
      ]
    },
    "6-12-3732-26-37-669": {
      "narrator_ids": [
        6,
        12,
        3732,
        26,
        37,
        669
      ],
      "verse_paths": [
        "/books/al-kafi:6:8:35:3"
      ]
    }
  },
  "source": {
    "provider": "ThaqalaynData",
    "baseUrl": "https://thaqalayndata.netlify.app",
    "localDir": "/home/ali/shia-library-json/tmp/ThaqalaynData",
    "license": "CC0-1.0",
    "dataPath": "/people/narrators/3732",
    "apiUrl": "file:///home/ali/shia-library-json/tmp/ThaqalaynData/people/narrators/3732.json"
  }
}
